{
  "schemaVersion": "1.0.0",
  "fixture": false,
  "release": {
    "id": "release-blorenge-2026-08-21.8",
    "datasetVersion": "2026-08-21.8",
    "publishedAt": null,
    "preparedAt": "2026-08-22T08:34:15.412Z",
    "retrievedAt": "2026-08-22T08:27:59.685Z",
    "nextReviewAt": "2026-09-21",
    "owner": "Tim Roberts",
    "manifestPath": "/releases/release-blorenge-2026-08-21.8/manifest.json",
    "manifestSha256": "2b5baf34235903dd948cca59d9b51f41215ccbf46e611b2d641545b36db6049e"
  },
  "map": {
    "center": [-3.0359, 51.7587],
    "zoom": 10.7,
    "assets": {
      "context": "/releases/release-blorenge-2026-08-21.8/assets/context.pmtiles",
      "terrain": "/releases/release-blorenge-2026-08-21.8/assets/terrain.pmtiles",
      "contours": "/releases/release-blorenge-2026-08-21.8/assets/terrain-contours.pmtiles",
      "change": "/releases/release-blorenge-2026-08-21.8/assets/observed-change.pmtiles",
      "ndvi": "/releases/release-blorenge-2026-08-21.8/assets/ndvi-change.pmtiles",
      "ndmi": "/releases/release-blorenge-2026-08-21.8/assets/ndmi-change.pmtiles",
      "effis": "/releases/release-blorenge-2026-08-21.8/assets/effis-592404.geojson",
      "download": "/releases/release-blorenge-2026-08-21.8/assets/evidence-states.csv.txt"
    }
  },
  "activeFire": {
    "currentPath": "/active-fire/current.json",
    "statusPath": "/active-fire/status.json"
  },
  "dates": [
    { "id": "seasonal-baseline", "label": { "en": "Seasonal baseline", "cy": "Llinell sylfaen dymhorol" }, "displayDate": { "en": "12 July 2025", "cy": "12 Gorffennaf 2025" }, "validAoiPercent": 99.865 },
    { "id": "before-report", "label": { "en": "Before first report", "cy": "Cyn yr adroddiad cyntaf" }, "displayDate": { "en": "12 July 2026", "cy": "12 Gorffennaf 2026" }, "validAoiPercent": 99.719 },
    { "id": "after-report", "label": { "en": "First qualifying post-report composite", "cy": "Cyfansawdd cymwys cyntaf ar ôl yr adroddiad" }, "displayDate": { "en": "29 July / 11 August 2026", "cy": "29 Gorffennaf / 11 Awst 2026" }, "validAoiPercent": 99.479 }
  ],
  "groups": [
    { "id": "evidence", "name": { "en": "Thermal anomalies and change", "cy": "Anomaleddau thermol a newid" }, "description": { "en": "A rolling satellite feed, mutually exclusive change views and a separate historic EFFIS interpretation", "cy": "Ffrwd loeren dreigl, golygon newid sy’n eithrio ei gilydd a dehongliad EFFIS hanesyddol ar wahân" } },
    { "id": "landscape", "name": { "en": "Landscape context", "cy": "Cyd-destun y dirwedd" }, "description": { "en": "Protection, paths, terrain and water", "cy": "Gwarchodaeth, llwybrau, tirwedd a dŵr" } },
    { "id": "historical", "name": { "en": "Historical context", "cy": "Cyd-destun hanesyddol" }, "description": { "en": "Dated sources that are not current condition", "cy": "Ffynonellau â dyddiad nad ydynt yn gyflwr presennol" } }
  ],
  "layers": [
    {
      "id": "thermal", "groupId": "evidence", "name": { "en": "Recent satellite thermal anomalies", "cy": "Anomaleddau thermol lloeren diweddar" },
      "description": { "en": "A separately operated 24-hour view of recent NOAA-21 and NOAA-20 VIIRS thermal-anomaly observations, with a filterable 30-day history.", "cy": "Golwg 24 awr a weithredir ar wahân o arsylwadau anomaledd thermol VIIRS NOAA-21 a NOAA-20 diweddar, gyda hanes 30 diwrnod y gellir ei hidlo." },
      "classification": "provisional", "defaultVisible": true, "mapStyle": "thermal", "temporal": true,
      "provider": "NASA FIRMS, VIIRS NOAA-21 and NOAA-20", "attribution": "Data: NASA FIRMS, VIIRS NOAA-21 and NOAA-20. Clipped and reformatted by Blorenge Commoners Association.",
      "evidenceStatus": { "en": "Operational satellite observations — freshness is shown live and detections are not verified incidents", "cy": "Arsylwadau lloeren gweithredol — dangosir ffresni’n fyw ac nid digwyddiadau wedi’u cadarnhau yw canfyddiadau" },
      "sourceDate": { "en": "Rolling 24-hour map and 30-day history; observation and publication times are shown with feed health", "cy": "Map 24 awr treigl a hanes 30 diwrnod; dangosir amseroedd arsylwi a chyhoeddi gyda iechyd y ffrwd" },
      "licence": "NASA FIRMS terms and BCA publication authority", "owner": "Tim Roberts", "nextReviewAt": "Continuous monitoring; contract review on source change",
      "method": { "en": "Query only VIIRS_NOAA21_NRT and VIIRS_NOAA20_NRT every six hours, validate and exact-clip observation centroids to the release AOI, then atomically publish checksum-addressed snapshots.", "cy": "Ymholi dim ond VIIRS_NOAA21_NRT a VIIRS_NOAA20_NRT bob chwe awr, dilysu a chlipio canolbwyntiau arsylwi’n union i AOI y rhyddhad, yna cyhoeddi cipluniau â chyfeiriad checksum yn atomig." },
      "limitations": [
        { "en": "A point is the centre of a nominal approximately 375 m observation pixel, not an exact heat or fire location or extent.", "cy": "Canol picsel arsylwi enwol tua 375 m yw pwynt, nid union leoliad nac arwynebedd gwres neu dân." },
        { "en": "A detection is not a verified incident, perimeter, warning, severity measure or forecast; absence of detections is not evidence that no fire exists.", "cy": "Nid digwyddiad wedi’i gadarnhau, terfyn, rhybudd, mesur difrifoldeb na rhagolwg yw canfyddiad; nid yw diffyg canfyddiadau’n dystiolaeth nad oes tân." },
        { "en": "Do not travel to investigate. Report immediate danger through 999 or 112.", "cy": "Peidiwch â theithio i ymchwilio. Rhowch wybod am berygl uniongyrchol drwy 999 neu 112." }
      ]
    },
    {
      "id": "change", "groupId": "evidence", "name": { "en": "Observed surface and vegetation change", "cy": "Newid arwyneb a llystyfiant a welwyd" },
      "description": { "en": "A conservative, uncalibrated comparison of valid Sentinel-2 observations, independently checked where Landsat was observable.", "cy": "Cymhariaeth geidwadol heb ei graddnodi o arsylwadau Sentinel-2 dilys, wedi’i gwirio’n annibynnol lle roedd Landsat yn weladwy." },
      "classification": "derived", "defaultVisible": true, "mapStyle": "change", "selectionGroup": "change-evidence", "temporal": true,
      "provider": "Copernicus Sentinel-2, USGS Landsat and BCA processing", "attribution": "Contains modified Copernicus Sentinel data 2025–2026; Landsat imagery courtesy of the U.S. Geological Survey",
      "evidenceStatus": { "en": "Versioned derived observation — not ecological recovery or a severity class", "cy": "Arsylwad deilliedig â fersiwn — nid adferiad ecolegol na dosbarth difrifoldeb" },
      "sourceDate": { "en": "12 July 2025, 12 July 2026 and 29 July / 11 August 2026 composite", "cy": "12 Gorffennaf 2025, 12 Gorffennaf 2026 a chyfansawdd 29 Gorffennaf / 11 Awst 2026" },
      "licence": "Copernicus Sentinel data legal notice; USGS public domain", "owner": "Tim Roberts", "nextReviewAt": "2026-09-13",
      "method": { "en": "Mask the two post observations independently, use valid 29 July pixels before 11 August fill, require three-role comparability and calculate continuous dNBR, NDVI and NDMI before displaying conservative evidence states. Landsat corroboration remains separate and is not fused.", "cy": "Masgio’r ddau arsylwad ôl-adroddiad yn annibynnol, defnyddio picseli dilys 29 Gorffennaf cyn llenwad 11 Awst, mynnu cymaroldeb tair rôl a chyfrifo dNBR, NDVI ac NDMI parhaus cyn dangos cyflyrau tystiolaeth geidwadol. Mae cadarnhad Landsat yn aros ar wahân ac nid yw wedi’i uno." },
      "limitations": [
        { "en": "Observed change is not proof of ecological recovery, habitat condition, cause or local severity.", "cy": "Nid yw newid a welwyd yn brawf o adferiad ecolegol, cyflwr cynefin, achos na difrifoldeb lleol." },
        { "en": "Pixels invalid on both 29 July and 11 August remain Not observed, never no change.", "cy": "Mae picseli annilys ar 29 Gorffennaf ac 11 Awst yn aros Heb eu harsylwi, byth yn ddim newid." }
      ],
      "accessibleDownload": "/releases/release-blorenge-2026-08-21.8/assets/evidence-states.csv.txt"
    },
    {
      "id": "ndvi", "groupId": "evidence", "name": { "en": "Vegetation greenness index change (NDVI)", "cy": "Newid mynegai gwyrddni llystyfiant (NDVI)" },
      "description": { "en": "A neutral signed difference in the vegetation greenness index across the release AOI; negative is lower and positive is higher.", "cy": "Gwahaniaeth niwtral ag arwydd ym mynegai gwyrddni llystyfiant ar draws AOI y rhyddhad; mae negyddol yn is a phositif yn uwch." },
      "classification": "derived", "defaultVisible": false, "mapStyle": "ndvi", "selectionGroup": "change-evidence", "temporal": true,
      "provider": "European Union Copernicus programme and BCA processing", "attribution": "Contains modified Copernicus Sentinel data 2025–2026; processing by Blorenge Commoners Association",
      "evidenceStatus": { "en": "Versioned 10 m signed index difference — not a fire, recovery or severity measure", "cy": "Gwahaniaeth mynegai 10 m ag arwydd ac â fersiwn — nid mesur tân, adferiad na difrifoldeb" },
      "sourceDate": { "en": "NDVI(29 July / 11 August 2026 composite) minus NDVI(12 July 2025)", "cy": "NDVI(cyfansawdd 29 Gorffennaf / 11 Awst 2026) llai NDVI(12 Gorffennaf 2025)" },
      "licence": "Copernicus Sentinel data legal notice and BCA publication authority", "owner": "Tim Roberts", "nextReviewAt": "2026-09-21",
      "method": { "en": "Calculate (B8 - B4) / (B8 + B4) at native 10 m after the common mask; use 29 July where independently valid, otherwise 11 August, otherwise Not observed.", "cy": "Cyfrifo (B8 - B4) / (B8 + B4) ar 10 m brodorol ar ôl y masg cyffredin; defnyddio 29 Gorffennaf lle mae’n ddilys yn annibynnol, neu 11 Awst fel arall, neu Heb ei arsylwi." },
      "limitations": [
        { "en": "The difference does not establish cause, fire damage, severity, habitat condition or recovery.", "cy": "Nid yw’r gwahaniaeth yn sefydlu achos, difrod tân, difrifoldeb, cyflwr cynefin nac adferiad." },